<?xml version="1.0"?>
<!DOCTYPE config SYSTEM "config.dtd">
<config name="brussels" alias=" @ Brussels" public-interfaces="eth0">
  <log level="info" />
  <database user="amo"
            password="cisco123"            
            name="service_discovery"
            host="localhost" 
            socket="/opt/lampp/var/mysql/mysql.sock"  
            port="3306"/> 
  <domain server="ks.vyncke.org"              
          zone="amo.vyncke.org"               
          keyname="amoupdate."                
          keyvalue="BK1wQkLhDySTEMhLDeDSdg==" 
          algorithm="HMAC_MD5"                
          ttl="60" />
  <ip version="4" alias=":v4]" />
  <ip version="6" alias=":v6]" />
  <interface name="eth2" alias=" [IT" />
  <interface name="eth1" alias=" [Sales" />
  <rules>
    <!-- Allow IPP services and services announced on IPv6. -->
    <service name=".*" type="_ipp\._tcp" interface-name=".*"  
             interface-ip=".*" hostname=".*" port=".*">allow</service>
    <service name=".*" type=".*" interface-name=".*"  
             interface-ip="6" hostname=".*" port=".*">allow</service>
    <service name=".*" type=".*" interface-name=".*"  
             interface-ip=".*" hostname=".*" port=".*">deny</service>
  </rules>
</config>
